{"id":"anchor.scene.playable.raid.machine_silo.spawn_entry","scene_id":"scene.playable.raid.machine_silo","display_name":"Raid Entry Spawn","room_id":"room.raid.entry_platform","anchor_kind":"spawn","entity_name":"RaidEntrySpawn","x_meters":"0.0","y_meters":"0.0","z_meters":"0.0","marker_ids":"room.raid.entry_platform,route.raid.entry"}
