{"id":"anchor.scene.playable.home_base.results_nook","scene_id":"scene.playable.home_base","display_name":"Results Nook","room_id":"room.home.results","anchor_kind":"results","entity_name":"ResultsNook","x_meters":"24.0","y_meters":"0.0","z_meters":"0.0","marker_ids":"room.home.results,landmark.results_nook"}
